наименование,цена,описание,характеристики
Лак на водной основе для мебели и стен PINOTEX LACKER AQUA10 матовый,970,"Колеруемый декоративно-защитный лак на водной основе.

Создает идеально гладкое покрытие. Придает поверхности отличный декоративный вид, подчеркивая естественную структуру древесины. Лак удобен в использовании, легко разравнивается, не оставляет потеков  и следов от инструмента.  Быстро высыхает на окрашенной поверхности, окрасочные работы можно провести за 1 день.

Лак одобрен для покраски детской мебели и игрушек, а также сертифицирован для лакирования деревянной посуды, безопасен при контакте с пищевыми продуктами



Придает поверхности грязе- и водооттакливающие свойства. Выдерживает воздействие моющих средств

Поверхность устойчива к ударам и царапинам

Эластичное покрытие, не растрескивается

Стойкое покрытие, не желтеет и не темнеет со временем, не изменяет естественный цвет древесины

Широкая палитра колеровки – 44 оттенка 

Лак для внутренних работ.  Не подходит для лакировки пола и паркета.

Бесцветный используется в качестве самостоятельного финишного покрытия, а также является Базой под колеровку (CLR), расширяя возможности выбора цветового решения интерьера

Подготовка поверхности

Поверхность должна быть сухой (влажность менее 18%), чистой, без отслоений.

Новую древесину очистите от загрязнений, обработайте шлифовальной бумагой до гладкости, затем удалите шлифовальную пыль.

Ранее покрытую лаком древесину полностью очистить до основания методом шлифования или специальным средством для снятия красок. Очистите поверхность от пыли и остатков старого покрытия, обработайте шлифовальной бумагой до гладкости. Очистите от шлифовальной пыли.

Особенности применения

Перед нанесением осторожно перемешайте лак, не допуская образования пузырьков. Наносите в 2-3 слоя кистью, валиком или распылителем вдоль досок при температуре воздуха и поверхности от +5°С до +30°С и относительной влажности воздуха от 40% до 80%. Используйте кисти и валики из качественного синтетического материала.

Наносите лак в 2-3 слоя вдоль досок.

Первый слой после высыхания слегка обработайте шлифовальной бумагой. Затем нанесите второй слой.

! При нанесении лак имеет молочно-белый цвет, после высыхания становится прозрачным.

В качестве первого (грунтовочного) слоя рекомендуется использовать глянцевый лак.

Разбавление не требуется.Для проверки оттенка колерованного лака рекомендуется сделать пробный выкрас на небольшом участке поверхности. Окончательный цвет покрытия зависит от сорта, твердости и первоначального цвета древесины, а также от количества нанесенных слоев.

Очистка инструментов

Чтобы уменьшить воздействие на окружающую среду, очистите инструмент от остатков пропитки, затем промойте водой.","{'Область применения': 'для изделий из древесины\xa0/\xa0внутрение стены\xa0/\xa0внутренние стены (межкомнатные перегородки)\xa0/\xa0стены', 'Степень блеска поверхности': 'матовая', 'Вид покрытия': 'оставляет природный рисунок древесины', 'Защита от УФ-излучения (солнца)': 'нет', 'Колеровка': 'ручная\xa0/\xa0автоматическая\xa0/\xa0готовый цвет', 'Состав,': 'водный', 'Готовность к применению': 'готов к применению', 'Бренд': 'Pinotex', 'Страна производителя': 'РОССИЯ', 'Цвет': 'бесцветный', 'Разбавитель (растворитель)': 'вода', 'Способ нанесения': 'кисть\xa0/\xa0валик', 'Время полного высыхания (ч)': '4', 'Температура применения, (град. C)': '+5 +30', 'Рекомендованное количество слоев покрытия': '2-3', 'Расход (1 слой), (кв.м/л)': '13 кв.м/л', 'Время высыхания между слоями (ч)': '2', 'Защита от плесени, грибка': 'нет', 'Тип поверхности': 'дерево', 'Фасовка (л)': '1', 'Базис': 'CLR'}"
Фасадный лак МультиПротект-Л для камня и кирпича - 1 л,760,"Лак фасадный для камня и кирпича МультиПротект-Л. Объем упаковки – 1 л.

Характеристики

После нанесения образует покрытие, обеспечивающее качественную защиту от атмосферных воздействий. Создает эффект «мокрого камня». Повышает прочность, твердость материала, придает ему гидроизолирующие свойства, предотвращает образование поражений биологического характера.

Особенности применения

Для наружных работ по природному и искусственному камню, облицовочному кирпичу и т.д.

Технология нанесения

Перед использованием лак тщательно перемешивается. В качестве инструмента применяется кисть, валик или распылитель. Наносится состав на заранее подготовленную, сухую и очищенную поверхность в 1 слой. В среднем на 1 м2 расходуется 150 – 200 г. Работать можно и с основаниями, где содержится остаточное количество влаги до 12%. К таким поверхностям можно отнести влажный бетон.

Оптимальная температура окружающей среды для эффективного нанесения лака – от -30°C до +30°C. Полимеризация завершенного покрытия наступает через 3 – 5 суток.

Техника безопасности

Хранение и транспортировка лака осуществляется в герметично закрытой емкости. Под складирование выбирается место вдали от отопительных приборов, защищенное от атмосферных воздействий, недоступное для детей.

Во время нанесения не допускать контакт лака с глазами, открытыми участками кожи, попадания внутрь организма. Обязательно использовать средства индивидуальной защиты: перчатки, респиратор, очки. В экстренной ситуации обратиться к врачу.

Утилизировать пустые емкости в качестве бытовых отходов. Остатки лака запрещено выливать в водоем, почву или канализацию.","{'Тип работ': 'наружные работы', 'Степень блеска поверхности': 'полуматовая', 'Вид покрытия': 'оставляет природный рисунок древесины', 'Защита от УФ-излучения (солнца)': 'светостойкий', 'Состав,': 'MS-полимер', 'Готовность к применению': 'готов к применению', 'Бренд': 'МультиПротект', 'Страна производителя': 'РОССИЯ', 'Цвет': 'бесцветный', 'Разбавитель (растворитель)': 'ацетон\xa0/\xa0ксилол', 'Способ нанесения': 'кисть\xa0/\xa0валик', 'Время полного высыхания (ч)': '72-120', 'Температура применения, (град. C)': '-15 +20', 'Расход (1 слой), (кв.м/л)': '150-200', 'Тип поверхности': 'натуральный камень', 'Фасовка (л)': '1'}"
"Аквалак для стен и потолков SIBERIAN полуматовый защитный, Husky (2.5л)",960,"Быстросохнущий полуматовый акриловый лак для ­долговечной защиты (до 10 лет) и финишной отделки деревянных стен и потолков внутри помещений. Используется для защиты ранее неокрашенных деревянных поверхностей от воздействия влажности, загрязнения, плесени и грибка. Лак не содержит растворителей и практически не пахнет. Может использоваться для кирпичных и каменных поверхностей. Не предназначен для лаки­рования напольных покрытий и поверхностей, ­находящихся в постоянном контакте с водой.



Для внутренних работ 

Создает покрытие с шелковистым блеском 

Сохраняет видимой текстуру древесины  

Быстро высыхает, практически не пахнет 

Не содержит растворителей  

Колеруется по каталогам TROX и COLTEC WOOD 

Защищает от влажности, загрязнения, плесени и грибка 

Лакированные поверхности можно мыть с применением мягких моющих средств

Прозрачная бесцветная ""база T"" (колеруется в полупрозрачные тона). Состав готов к применению, разбавление не рекомендуется.

ПОДГОТОВКА ПОВЕРХНОСТИ: Основание должно быть сухим, очищенным от смол и других загрязнений. Старые покрытия удалить.

НАНЕСЕНИЕ: HUSKY Siberian Аквалак в таре имеет белый оттенок, после высыхания лак становится полностью прозрачным. Перед применением тщательно перемешать. Наносить в  2-3 тонких слоя кистью или валиком по направлению древесных волокон. Рекомендуется окрашивать всю поверхность от угла до угла, не дожидаясь высыхания. Следующий слой наносить через 8 часов. Температура при проведении работ и последующие 48 часов не должна опускаться ниже +10°С.

ВРЕМЯ ВЫСЫХАНИЯ: При температуре +20°С и влажности воздуха 65% время высыхания от пыли 1 час, полное высыхание – 24 часа.","{'Тип работ': 'внутренние работы', 'Область применения': 'стены\xa0/\xa0потолки', 'Степень блеска поверхности': 'полуматовая', 'Вид покрытия': 'оставляет природный рисунок древесины', 'Защита от УФ-излучения (солнца)': 'нет', 'Колеровка': 'автоматическая\xa0/\xa0готовый цвет', 'Состав,': 'акриловый', 'Готовность к применению': 'готов к применению', 'Срок службы,': 'до 10 лет', 'Бренд': 'Husky', 'Страна производителя': 'РОССИЯ', 'Цвет': 'бесцветный', 'Разбавитель (растворитель)': 'вода', 'Способ нанесения': 'кисть\xa0/\xa0валик', 'Время полного высыхания (ч)': '24', 'Температура применения, (град. C)': 'не ниже +10', 'Рекомендованное количество слоев покрытия': '2-3', 'Расход (1 слой), (кв.м/л)': '1 л на 7-10 кв.м', 'Время высыхания между слоями (ч)': '8', 'Защита от плесени, грибка': 'да', 'Тип поверхности': 'кирпич\xa0/\xa0дерево', 'Фасовка (л)': '2.5', 'Базис': 'Т'}"
"Лак по камню ""Рельеф"" РЕЛЬЕФ_pr (2.5кг)",740,"Лак по камню предназначен для декоративной отделки и защиты природного и искусственного камня, кирпича, черепицы (фасады и цоколи зданий, каменные заборы, декоративная отделка каминов), кроме полов и мест с высокой эксплуатационной нагрузкой (тротуарной плитки, камня для мощения дорожек). Лак можно наносить на древесину, изделия изнее. Для наружных и внутренних работ.

Преимущества:





эффект «мокрого камня» - сохраняет естественный цвет покрытия, освежая внешний вид поверхности



высокая проникающая способность



укрепляет поверхность, защищая от образования микротрещин



повышает морозостойкость



предотвращает образование высолов и биоразрушений



экологически безопасен



без запаха.

Применение: продукт готов к применению. Перед применением лак тщательно перемешать. Очистить поверхность от грязи, пыли.

Способ применения: кистью, валиком, краскопультом, погружение. Работы проводить при температуре не ниже +5°С. Наносить лак без подтеков и наплывов, равномерно распределяя по поверхности. В зависимости от типа минеральной подложки декоративный эффект будет проявляться по-разному, рекомендуется сделать тестовый выкрас на небольшой площади поверхности. Наносить в 1-2 слоя с промежуточной сушкой 1 час. Поверхность следует защитить от попадания воды и атмосферных осадков до полного высыхания на 24 часа при температуре 16-20°С и относительной влажности воздуха 60 %.

Меры предосторожности: состав не горюч, не токсичен, практически не имеет запаха. После нанесения инструменты промыть водой. При попадании в глаза тщательно промыть водой. При работе использовать перчатки.

Хранение и транспортировка: транспортировать отдельно от пищевых продуктов. Беречь от детей и домашних животных. Хранить в плотно закрытой таре при температуре от +5°С до +30°С. Выдерживает 5 циклов кратковременного замораживания-размораживания. В случае замерзания выдержать при комнатной температуре, затем тщательно перемешать.

Срок годности: 24 месяца в герметичной заводской таре. Утилизация согласно СанПиН № 2.1.7.1322-03.

Состав: акриловая дисперсия, микронизированный воск, композиция высокоэффективных антисептических и биоцидных добавок, функциональные добавки, вода. Не содержит запрещенных в ЕС и РФ веществ.","{'Тип работ': 'внутренние работы\xa0/\xa0наружные работы', 'Область применения': 'облицовка каминов\xa0/\xa0для изделий из древесины', 'Вид покрытия': 'оставляет природный рисунок древесины', 'Колеровка': 'нет', 'Состав,': 'акриловый\xa0/\xa0воск', 'Готовность к применению': 'готов к применению', 'Бренд': 'РЕЛЬЕФ', 'Страна производителя': 'РОССИЯ', 'Цвет': 'бесцветный', 'Способ нанесения': 'кисть\xa0/\xa0валик\xa0/\xa0окунание\xa0/\xa0краскораспылитель', 'Время полного высыхания (ч)': '24', 'Расход (1 слой), (г/кв.м)': '150-200', 'Температура применения, (град. C)': 'от +5', 'Рекомендованное количество слоев покрытия': '1-2', 'Время высыхания между слоями (ч)': '1', 'Защита от плесени, грибка': 'да', 'Тип поверхности': 'кирпич\xa0/\xa0натуральный камень\xa0/\xa0дерево\xa0/\xa0камень', 'Фасовка, (кг)': '2.5'}"
