наименование,цена,описание,характеристики
Краска резиновая Dali для кровли цоколя фасада коричневый 12 кг,4 153,"Краска акриловая Dali резиновая для кровли, цоколя, фасада коричневая. Вес упаковки — 12 кг. Тиксотропная, наносится без подтеков и разводов даже на фигурные поверхности. Не имеет неприятного запаха.

Краска способна скрыть трещины величиной до 3 мм, а также другие мелкие дефекты основания, препятствует их появлению. В составе использован активный антисептик, который дает надежную защиту от плесени, грибка. 

Покрытие создается прочное, устойчивое к атмосферным воздействиям и температурным колебаниям (выдержит изменения от -40°С до +40°С). Оно не боится и ультрафиолетового излучения, способно выдержать неоднократную влажную чистку с использованием специальных моющих средств. Усиливает шумоизоляцию кровли и главное — не блокирует движение воздуха. Оно является паропроницаемым. Превосходный вариант для зданий с естественной усадкой.

Особенности применения

Продукт используется при проведении наружных и внутренних окрасочных работ. Он предназначен:

- для минеральных поверхностей (шифер волнистый и плоский, черепица цементно-песчаная, бетонные изделия, кирпич, цементно-стружечные плиты, асбестоцементные плиты и т.?д.);

- для сухой древесины ОСБ, ДСП, ДВП при строительстве каркасных и модульных домов;

- для оцинкованной стали, предварительно обработанной грунтом.

Технология нанесения

Перед применением краску необходимо тщательно перемешать. Поверхность перед обработкой подготовить. Она должна быть чистой, сухой, без старых отслаивающихся покрытий. При необходимости сделать обезжиривание. При работе с металлом подготовительные действия такие же. Очистка, обезжиривание, сушка. В случае с черным металлом поверхность следует загрунтовать составом ГФ-021 или его аналогом.

Условия для окрашивания: температура окружающего воздуха и поверхности не ниже +10°С. Инструменты: кисть, валик, распылитель. Разбавление допускается, но не более чем на 5% от общей массы состава. 

Покрытие формируется толщиной в 2 слоя. Средний расход составляет 1 кг на 5 м2 поверхности. На практике цифры могут быть другими. Они зависят от качества основания, толщины покрытия и выбранного инструмента.

Межслойная сушка при создании покрытия обязательна. На вертикальных поверхностях она составляет 1 час, на горизонтальных — до 2 часов. Окончательный набор прочности покрытия может занять до 7 суток. Все цифры указаны при условии, что температура окружающей среды составляет +20±2°C.

Автоматическая колеровка осуществляется по каталогам: NCS 1950, Nova 2024, RAL. Ручная - колеровочными красками Dali или универсальными пастами Dali, но не более чем на 4% от общей массы состава.

Техника безопасности

Хранение продукции осуществляется в помещении, защищенном от внешних воздействий, в месте, недоступном для детей. Температурные условия: от +5°С до +35°С. Краска способна выдержать до 5 циклов замораживания/оттаивания. Либо однократную нециклическую заморозку на срок до 30 суток.

Окрашивание проводить только с использованием средств индивидуальной защиты. Беречь от попадания глаза, избегать контакта с открытыми участками кожи, не принимать внутрь. В экстренной ситуации обратиться за помощью к врачу. 

Жидкие остатки запрещено выливать в водоем, канализацию или почву. Пустые емкости с засохшей краской утилизируются как бытовые отходы.","{'Степень блеска поверхности': 'глубокоматовая', 'Тип поверхности': 'кирпич\xa0/\xa0бетон\xa0/\xa0дерево\xa0/\xa0ДВП\xa0/\xa0ДСП\xa0/\xa0минеральные поверхности\xa0/\xa0оштукатуренная поверхность\xa0/\xa0металл\xa0/\xa0ГКЛ', 'Колеровка': 'готовый цвет', 'Состав,': 'акриловый', 'Тип работ': 'внутренние работы\xa0/\xa0наружные работы', 'Бренд': 'Dali', 'Страна производителя': 'РОССИЯ', 'Цвет': 'коричневый', 'Разбавитель (растворитель)': 'вода', 'Способ нанесения': 'кисть\xa0/\xa0валик\xa0/\xa0краскораспылитель', 'Время полного высыхания (ч)': '24', 'Время высыхания на отлип, (ч)': '0.25', 'Расход (1 слой), (г/кв.м)': '100', 'Температура применения, (град. C)': 'от +10', 'Рекомендованное количество слоев покрытия': '2', 'Время высыхания первого слоя (ч)': '1', 'Фасовка, (кг)': '12'}"
Краска резиновая Dali для кровли цоколя фасада (База С) бесцветная 12 кг,3 581,"Краска акриловая Dali резиновая для кровли, цоколя, фасада, База C, бесцветная. Вес упаковки — 12 кг. Не имеет неприятного запаха, тиксотропная, наносится легко любым инструментом без подтеков и брызг даже на фигурные основания.

Краской можно скрыть трещины, другие мелкие дефекты поверхности величиной до 3 мм. В ее составе также содержится антисептик. Он помогает избежать появления плесени, грибка.

Создаваемое покрытие отличается прочностью. Оно без проблем выдерживает атмосферные воздействия, перепады температур. Окрашенная поверхность не боится и ультрафиолетового излучения, неоднократной влажной чистки с использованием специальных моющих средств. 

Покрытие усиливает шумоизоляцию кровли и главное — не блокирует движение воздуха. Оно является паропроницаемым. Превосходный вариант для зданий с естественной усадкой.

Особенности применения

Краска обладает широкой областью использования. Ее можно применять как на открытом воздухе, так и внутри помещений. При наружных работах выполняют защитно-декоративную окраску крыш, фасадов, цоколей зданий и сооружений, которые требуют долговременной эксплуатации и ввиду этого подвержены появлению трещин. При внутренних - состав используют во влажных или неотапливаемых помещениях. Краской покрывают стены и потолки.

Продукт предназначен:

- для минеральных поверхностей (шифер волнистый и плоский, черепица цементно-песчаная, бетонные изделия, кирпич, цементно-стружечные плиты, асбестоцементные плиты и т.?д.);

- для сухой древесины ОСБ, ДСП, ДВП при строительстве каркасных и модульных домов;

- для оцинкованной стали, предварительно обработанной грунтом.

Технология нанесения

Перед применением краску необходимо тщательно перемешать. Поверхность перед обработкой подготовить. Она должна быть чистой, сухой, без старых отслаивающихся покрытий. При необходимости сделать обезжиривание.

При работе с металлом подготовительные действия такие же. Очистка, обезжиривание, сушка. В случае с черным металлом поверхность следует загрунтовать составом ГФ-021 или его аналогом.

Условия для окрашивания: температура окружающего воздуха и поверхности не ниже +10°С. Инструменты: кисть, валик, распылитель. Разбавление допускается, но не более чем на 5% от общей массы состава. 

Покрытие формируется толщиной в 2 слоя. Средний расход составляет 1 кг на 5 м2 поверхности. На практике цифры могут быть другими. Они зависят от качества основания, толщины покрытия и выбранного инструмента.

Межслойная сушка при создании покрытия обязательна. На вертикальных поверхностях она составляет 1 час, на горизонтальных — до 2 часов. Окончательный набор прочности покрытия может занять до 7 суток. Все цифры указаны при условии, что температура окружающей среды составляет +20±2°C.

Автоматическая колеровка осуществляется по каталогам: NCS 1950, Nova 2024, RAL. Ручная - колеровочными красками Dali или универсальными пастами Dali, но не более чем на 4% от общей массы состава.

Техника безопасности

Хранение продукции осуществляется в помещении, защищенном от внешних воздействий, в месте, недоступном для детей. Температурные условия: от +5°С до +35°С. Краска способна выдержать до 5 циклов замораживания/оттаивания. Либо однократную нециклическую заморозку на срок до 30 суток.

Окрашивание проводить только с использованием средств индивидуальной защиты. Беречь от попадания глаза, избегать контакта с открытыми участками кожи, не принимать внутрь. В экстренной ситуации обратиться за помощью к врачу. 

Жидкие остатки запрещено выливать в водоем, канализацию или почву. Пустые емкости с засохшей краской утилизируются как бытовые отходы.","{'Степень блеска поверхности': 'глубокоматовая', 'Тип поверхности': 'кирпич\xa0/\xa0бетон\xa0/\xa0дерево\xa0/\xa0ДВП\xa0/\xa0ДСП\xa0/\xa0минеральные поверхности\xa0/\xa0оштукатуренная поверхность\xa0/\xa0металл\xa0/\xa0ГКЛ', 'Колеровка': 'ручная\xa0/\xa0автоматическая', 'Состав,': 'акриловый', 'Тип работ': 'внутренние работы\xa0/\xa0наружные работы', 'Бренд': 'Dali', 'Страна производителя': 'РОССИЯ', 'Цвет': 'бесцветный, прозрачный', 'Разбавитель (растворитель)': 'вода', 'Способ нанесения': 'кисть\xa0/\xa0валик\xa0/\xa0краскораспылитель', 'Время полного высыхания (ч)': '24', 'Время высыхания на отлип, (ч)': '0.25', 'Расход (1 слой), (г/кв.м)': '100', 'Температура применения, (град. C)': 'от +10', 'Рекомендованное количество слоев покрытия': '2', 'Время высыхания первого слоя (ч)': '1', 'Базис': 'C', 'Фасовка, (кг)': '12'}"
Краска акриловая фасадная ТЕКС Профи Белая матовая - 9 л,3 399,"Краска фасадная ТЕКС Профи. Основа - акриловая. Цвет - белый, матовый. Объем упаковки - 9 л. 

Характеристики

Легко наносится на фасад без брызг и потеков, формируя прочное защитное покрытие, устойчивое к атмосферным воздействиям, а также механическим повреждениям. Предотвращает появление и развитие биологических поражений (плесень, грибок и т.д.).

Особенности применения

Используется для окрашивания конструкций минерального происхождения, а именно бетонных стен, цементных штукатурок, не глянцевой керамики. 

Подойдет для обработки покрытий, которые прочно держатся на своей основе, поверхностей с уже имеющимся слоем водно - дисперсионного или перхлорвинилового средства.

Технология нанесения

Оптимальные условия для проведения работ:

- температура окружающей среды не ниже +5°С;

- относительная влажность воздуха не более 80%.

Окрашивание не делается в жаркую, дождливую или ветреную погоду под прямым воздействием солнечных лучей.

Предварительная подготовка проводится максимально тщательно.

Неокрашенная поверхность. Очищается от пыли, посторонних включений. Новые фасады из бетона окрашиваются после одного отопительного сезона. Поверхности, которые были оштукатурены - через 1 - 2 месяца. Основания, состоящие из фиброцементных плит - через 6 месяцев.

Объекты с глянцевой поверхностью сначала проходятся пескоструйным аппаратом или жесткой стальной щеткой. Так создается подходящий для окрашивания профиль.

Поверхности, которые сильно мелятся, осыпаются, тщательно очищаются. Непрочный слой удаляется до крепкого основания. 

При наличии биологических поражений применяется специальное санирующее средство. Непосредственно перед применением краски поверхность грунтуется. Если бетонная основа прочная, то это действие не требуется.

Ранее окрашенная поверхность. Также подвергается тщательно очистке. Отслаивающееся покрытие удаляется с помощью пескоструйного аппарата или металлической щетки. Обязательно проверяется состояние соединительных швов, при наличии дефектов они устраняются. 

Если в структуре присутствуют трещины стальной арматуры, то они раскрываются шлифовкой, скоблением. Металл очищается от коррозии, наносится защитное средство. 

При наличии биологических поражений применяется соответствующий санирующий состав. Поверхность моется чистящим средством, затем водой. Дефекты выравниваются шпатлевкой.

Сильно мелящиеся поверхности очищаются до прочного основания. Во всех остальных случаях это действие не требуется. Участки с хорошей впитываемостью проходятся грунтовкой.

В качестве инструментов для работы используется традиционная кисть, валик или распылитель. Краска сначала тщательно перемешивается. Наносится в 2 слоя. Если состав имеет белый цвет или поверхность частично зашпатлевана необходимо достичь оптимальной укрывистости. Это делается укладкой еще одного 3 слоя.

Разбавление водой допустимо, если того требует ситуация. Для первого слоя - на 10%. При формировании финишного покрытия краска разбавляется не более чем на 5%. При этом обязательно достигается рабочий показатель вязкости.

При окрашивании большой по площади поверхности не рекомендуется делать перерывов. В местах перехлестов состав наносится методом ""мокрое-по-мокрому"". Завершается окраска согласно архитектурным границам здания.

После нанесения первого слоя ему требуется 1 час на высыхание. Второй - укладывается через 12 часов.

При температуре воздуха ниже +15°С и относительной влажности воздуха выше 65% следующий слой наносится не ранее, чем через 24 часа.

1 литр краски в среднем расходуется на:

- 4 - 6 м2 впитывающей поверхности;

- 6 - 8 м2 невпитывающей поверхности.

Реальный расход может отличаться от данных цифр. На него влияет толщина каждого слоя, выбор инструмента для работы, а также качество поверхности и степень ее подготовки.

Техника безопасности

Краска относится к классу пожаро- и взрывобезопасных продуктов. Во время работы рекомендуется использовать средства индивидуальной защиты: резиновые перчатки, очки, респиратор. Избегать контакта с открытыми участками кожи, попадания в органы дыхания, зрения. В экстренной ситуации, например, при проглатывании, незамедлительно обратиться к врачу.

Остатки состава запрещено выливать в канализацию, водоем, почву. Пустая тара утилизируется как бытовые отходы.","{'Степень блеска поверхности': 'матовая', 'Защита от плесени, грибка': 'да', 'Колеровка': 'ручная\xa0/\xa0автоматическая\xa0/\xa0готовый цвет', 'Тип поверхности': 'минеральные поверхности', 'Срок службы,': 'до 7 лет', 'Тип работ': 'внутренние работы\xa0/\xa0наружные работы', 'Бренд': 'ТЕКС.', 'Страна производителя': 'РОССИЯ', 'Цвет': 'белый', 'Состав,': 'акриловый', 'Разбавитель (растворитель)': 'вода', 'Способ нанесения': 'кисть\xa0/\xa0валик\xa0/\xa0краскораспылитель', 'Время полного высыхания (ч)': '12', 'Рекомендованное количество слоев покрытия': '2', 'Расход (1 слой), (кв.м/л)': '7', 'Время высыхания между слоями (ч)': '12', 'Фасовка (л)': '9', 'Базис': 'A'}"
