наименование,цена,описание,характеристики
Лак Кудо акриловый  универсал аэрозоль матовый,299,"Высококачественный акриловый лак предназначен для создания матового защитного и декоративного покрытия окрашенным и неокрашенным изделиям из металла, дерева, пластика и т. д. Применяется для наружных и внутренних работ.

Позволяет скрыть дефекты неравномерного покрытия, не желтеет, обеспечивает устойчивость покрытия к механическим воздействиям и истиранию. Обладает превосходной адгезией к окрашиваемой поверхности и повышенной атмосферостойкостью.









Во избежание попадания следов аэрозоля рекомендуется защищать поверхности, не подлежащиелакировке.

Для достижения наилучших результатов лак следует наносить при температуре окружающей среды не ниже +10°С.

Перед использованием баллон энергично встряхивать в течение 2–3-х минут.

Лак следует наносить, избегая перелива, с расстояния 25–30 см на чистую, сухую и тщательно обезжиренную поверхность в 2–3 слоя с промежуточной сушкой 5–10 минут. Время сушки «на отлип» 20–30 минут при температуре +20°С. Время полного высыхания 2 часа при температуре +20°С.

Внимание! По окончании работы во избежание засорения головки распылителя перевернуть баллон вверх дном и распылять до тех пор, пока не перестанет поступать состав.","{'Тип работ': 'внутренние работы\xa0/\xa0наружные работы', 'Степень блеска поверхности': 'матовая', 'Состав,': 'акриловый', 'Бренд': 'Kudo', 'Страна производителя': 'РОССИЯ', 'Цвет': 'бесцветный', 'Способ нанесения': 'через форсунку баллона', 'Время полного высыхания (ч)': '2', 'Кол-во в упаковке, (шт)': '12', 'Время высыхания на отлип, (ч)': '0.5', 'Кратность отгрузки, (шт)': '1', 'Расход (1 слой), (г/кв.м)': '0.26мл/кв.м', 'Рекомендованное количество слоев покрытия': '2-3', 'Время высыхания первого слоя (ч)': '0.17', 'Тип поверхности': 'дерево\xa0/\xa0пластик / ПВХ\xa0/\xa0металл', 'Фасовка (л)': '0.52'}"
"Аквалак для стен и потолков SIBERIAN полуматовый защитный, Husky (0.9л)",360,"Быстросохнущий полуматовый акриловый лак для ­долговечной защиты (до 10 лет) и финишной отделки деревянных стен и потолков внутри помещений. Используется для защиты ранее неокрашенных деревянных поверхностей от воздействия влажности, загрязнения, плесени и грибка. Лак не содержит растворителей и практически не пахнет. Может использоваться для кирпичных и каменных поверхностей. Не предназначен для лаки­рования напольных покрытий и поверхностей, ­находящихся в постоянном контакте с водой.



Для внутренних работ 

Создает покрытие с шелковистым блеском 

Сохраняет видимой текстуру древесины  

Быстро высыхает, практически не пахнет 

Не содержит растворителей  

Колеруется по каталогам TROX и COLTEC WOOD 

Защищает от влажности, загрязнения, плесени и грибка 

Лакированные поверхности можно мыть с применением мягких моющих средств

Прозрачная бесцветная ""база T"" (колеруется в полупрозрачные тона). Состав готов к применению, разбавление не рекомендуется.

ПОДГОТОВКА ПОВЕРХНОСТИ: Основание должно быть сухим, очищенным от смол и других загрязнений. Старые покрытия удалить.

НАНЕСЕНИЕ: HUSKY Siberian Аквалак в таре имеет белый оттенок, после высыхания лак становится полностью прозрачным. Перед применением тщательно перемешать. Наносить в  2-3 тонких слоя кистью или валиком по направлению древесных волокон. Рекомендуется окрашивать всю поверхность от угла до угла, не дожидаясь высыхания. Следующий слой наносить через 8 часов. Температура при проведении работ и последующие 48 часов не должна опускаться ниже +10°С.

ВРЕМЯ ВЫСЫХАНИЯ: При температуре +20°С и влажности воздуха 65% время высыхания от пыли 1 час, полное высыхание – 24 часа.","{'Тип работ': 'внутренние работы', 'Область применения': 'стены\xa0/\xa0потолки', 'Степень блеска поверхности': 'полуматовая', 'Вид покрытия': 'оставляет природный рисунок древесины', 'Защита от УФ-излучения (солнца)': 'нет', 'Колеровка': 'автоматическая\xa0/\xa0готовый цвет', 'Состав,': 'акриловый', 'Готовность к применению': 'готов к применению', 'Срок службы,': 'до 10 лет', 'Бренд': 'Husky', 'Страна производителя': 'РОССИЯ', 'Цвет': 'бесцветный', 'Разбавитель (растворитель)': 'вода', 'Способ нанесения': 'кисть\xa0/\xa0валик', 'Время полного высыхания (ч)': '24', 'Температура применения, (град. C)': 'не ниже +10', 'Рекомендованное количество слоев покрытия': '2-3', 'Расход (1 слой), (кв.м/л)': '1 л на 7-10 кв.м', 'Время высыхания между слоями (ч)': '8', 'Защита от плесени, грибка': 'да', 'Тип поверхности': 'кирпич\xa0/\xa0дерево', 'Фасовка (л)': '0.9', 'Базис': 'Т'}"
Лак Кудо акриловый  универсальный аэрозоль,299,"Высокоглянцевый акриловый лак предназначен для создания защитного покрытия и придания декоративного блеска окрашенным и неокрашенным изделиям из металла, дерева, пластика и т. д. Применяется для наружных и внутренних работ.

Позволяет скрыть дефекты неравномерного покрытия, не желтеет и обеспечивает устойчивость покрытия к механическим воздействиям и истиранию. Обладает превосходной адгезией к окрашиваемой поверхности и повышенной атмосферостойкостью.









Во избежание попадания следов аэрозоля рекомендуется защищать поверхности, не подлежащиелакировке.

Для достижения наилучших результатов лак следует наносить при температуре окружающей среды не ниже +10°С.

Перед использованием баллон энергично встряхивать в течение 1–2-х минут.

Лак следует наносить, избегая перелива, с расстояния 25–30 см на чистую, сухую и тщательно обезжиренную поверхность в 2–3 слоя с промежуточной сушкой 5–10 минут. Время сушки «на отлип» 20–30 минут при температуре +20°С. Время полного высыхания 2 часа при температуре +20°С.

Внимание! По окончании работы во избежание засорения головки распылителя перевернуть баллон вверх дном и распылять до тех пор, пока не перестанет поступать состав.","{'Тип работ': 'внутренние работы\xa0/\xa0наружные работы', 'Степень блеска поверхности': 'глянцевая', 'Состав,': 'акриловый', 'Бренд': 'Kudo', 'Страна производителя': 'РОССИЯ', 'Цвет': 'бесцветный', 'Способ нанесения': 'через форсунку баллона', 'Время полного высыхания (ч)': '2', 'Кол-во в упаковке, (шт)': '12', 'Время высыхания на отлип, (ч)': '0,5', 'Кратность отгрузки, (шт)': '1', 'Расход (1 слой), (г/кв.м)': '0.26мл/кв.м', 'Рекомендованное количество слоев покрытия': '2-3', 'Время высыхания первого слоя (ч)': '0.17', 'Тип поверхности': 'дерево\xa0/\xa0пластик / ПВХ\xa0/\xa0металл', 'Фасовка (л)': '0.52'}"
"Лак по камню ""Рельеф"" РЕЛЬЕФ_pr (0.9кг)",280,"Лак по камню предназначен для декоративной отделки и защиты природного и искусственного камня, кирпича, черепицы (фасады и цоколи зданий, каменные заборы, декоративная отделка каминов), кроме полов и мест с высокой эксплуатационной нагрузкой (тротуарной плитки, камня для мощения дорожек). Лак можно наносить на древесину, изделия изнее. Для наружных и внутренних работ.

Преимущества:





эффект «мокрого камня» - сохраняет естественный цвет покрытия, освежая внешний вид поверхности



высокая проникающая способность



укрепляет поверхность, защищая от образования микротрещин



повышает морозостойкость



предотвращает образование высолов и биоразрушений



экологически безопасен



без запаха.

Применение: продукт готов к применению. Перед применением лак тщательно перемешать. Очистить поверхность от грязи, пыли.

Способ применения: кистью, валиком, краскопультом, погружение. Работы проводить при температуре не ниже +5°С. Наносить лак без подтеков и наплывов, равномерно распределяя по поверхности. В зависимости от типа минеральной подложки декоративный эффект будет проявляться по-разному, рекомендуется сделать тестовый выкрас на небольшой площади поверхности. Наносить в 1-2 слоя с промежуточной сушкой 1 час. Поверхность следует защитить от попадания воды и атмосферных осадков до полного высыхания на 24 часа при температуре 16-20°С и относительной влажности воздуха 60 %.

Меры предосторожности: состав не горюч, не токсичен, практически не имеет запаха. После нанесения инструменты промыть водой. При попадании в глаза тщательно промыть водой. При работе использовать перчатки.

Хранение и транспортировка: транспортировать отдельно от пищевых продуктов. Беречь от детей и домашних животных. Хранить в плотно закрытой таре при температуре от +5°С до +30°С. Выдерживает 5 циклов кратковременного замораживания-размораживания. В случае замерзания выдержать при комнатной температуре, затем тщательно перемешать.

Срок годности: 24 месяца в герметичной заводской таре. Утилизация согласно СанПиН № 2.1.7.1322-03.

Состав: акриловая дисперсия, микронизированный воск, композиция высокоэффективных антисептических и биоцидных добавок, функциональные добавки, вода. Не содержит запрещенных в ЕС и РФ веществ.","{'Тип работ': 'внутренние работы\xa0/\xa0наружные работы', 'Область применения': 'облицовка каминов\xa0/\xa0для изделий из древесины', 'Вид покрытия': 'оставляет природный рисунок древесины', 'Колеровка': 'нет', 'Состав,': 'акриловый\xa0/\xa0воск', 'Готовность к применению': 'готов к применению', 'Бренд': 'РЕЛЬЕФ', 'Страна производителя': 'РОССИЯ', 'Цвет': 'бесцветный', 'Способ нанесения': 'кисть\xa0/\xa0валик\xa0/\xa0окунание\xa0/\xa0краскораспылитель', 'Время полного высыхания (ч)': '24', 'Расход (1 слой), (г/кв.м)': '150-200', 'Температура применения, (град. C)': 'от +5', 'Рекомендованное количество слоев покрытия': '1-2', 'Время высыхания между слоями (ч)': '1', 'Защита от плесени, грибка': 'да', 'Тип поверхности': 'кирпич\xa0/\xa0натуральный камень\xa0/\xa0дерево\xa0/\xa0камень', 'Фасовка, (кг)': '0.9'}"
Яхтный лак для дерева EUROTEX Бесцветный глянцевый - 2 л,1 496,"Лак яхтный для дерева EUROTEX. Бесцветный, глянцевый. Объем упаковки – 2 л.

Характеристики

Лак легко наносится, глубоко проникает в структуру материала, укрепляя его. Формирует покрытие атмосферостойкое. Оно хорошо справляется с эксплуатацией в морском климате. А также:

- без проблем выдерживает попадание слабых кислот, средств бытовой химии;

- устойчивое к появлениям трещин, сколов, царапин;

- не боится абразивного износа, истирания.

В качестве одного из основных компонентов лака присутствует антисептик. Его задача – предотвратить появление поражений биологического характера.

Ультрафиолетовые фильтры защищают покрытие от солнечных лучей, исключая тем самым его выгорание.

Лак несет и декоративные свойства. Он качественно подчеркивает естественный рисунок древесины.

Особенности применения

Для внутренних и наружных работ по вертикальным и горизонтальным поверхностям. Лаком покрывают материалы:

- новые или старые (не окрашивавшиеся, либо предварительно очищенные от прошлого слоя ЛКМ);

- древесной основы. Это ДСП, ДВП, фанера, пробка и т.д.

Технология нанесения

Оптимальными условиями для проведения работ являются:

- температура окружающей среды от +5°C;

- влажность воздуха не более 80%;

- влажность материала не более 15%.

В рамках подготовки поверхность, которая ранее окрашивалась или же имеет очаги биологических поражений, очищается. Устраняются все посторонние включения.

Если древесина потемнела, а такое случается в ходе длительной эксплуатации, то ее отбеливают специальным составом WoodMaster Иней или WoodMaster Иней Проф.

В завершении поверхность грунтуется. Здесь можно использовать состав соответствующего назначения. Либо разбавить сам лак уайт-спиритом на 20% и применить этот раствор.

В качестве инструмента при окрашивании используется традиционная кисть, валик или распылитель. Лак в емкости перемешивается. Наносится в 2 – 3 слоя. Промежуточная шлифовка после высыхания каждого обязательна. Для этого можно воспользоваться мелкозернистой наждачной бумагой.

Если рабочая область ранее имела покрытие из краски, то делается пробное нанесение лака. Это поможет понять уровень адгезии состава к поверхности.

Длительность межслойной сушки составляет 12 часов. Полная готовность покрытия занимает 7 суток.

1 литр лака расходуется на:

- 13 – 17 м2 при грунтовании;

- 9 – 13 м2 при нанесении финишного покрытия.

Техника безопасности

Хранение продукции организуется в месте, защищенном от атмосферных воздействий, удаленном от источников огня и недоступном для детей. Во время окрашивания обязательно используются средства индивидуальной защиты: резиновые перчатки, очки, респиратор. Рекомендуется избегать контакта состава с открытыми участками кожи, органами дыхания, зрения. В случае экстренных ситуаций, например, при попадании внутрь, незамедлительно обратиться к врачу.

Пустые емкости от лака утилизируются в качестве бытовых отходов. Остатки выливать в водоем, канализацию или почву запрещено. Их помещают в емкость так, чтобы она была вся заполнена. Закрывают плотно крышкой и отправляют на хранение.","{'Тип работ': 'внутренние работы\xa0/\xa0наружные работы', 'Степень блеска поверхности': 'глянцевая', 'Вид покрытия': 'оставляет природный рисунок древесины', 'Защита от УФ-излучения (солнца)': 'усиленная', 'Колеровка': 'ручная\xa0/\xa0автоматическая\xa0/\xa0готовый цвет', 'Состав,': 'алкидно-уретановый', 'Готовность к применению': 'готов к применению', 'Срок службы,': 'до 8 лет', 'Бренд': 'Eurotex', 'Страна производителя': 'РОССИЯ', 'Цвет': 'бесцветный', 'Разбавитель (растворитель)': 'уайт-спирит', 'Способ нанесения': 'кисть\xa0/\xa0валик\xa0/\xa0краскораспылитель', 'Время полного высыхания (ч)': '168', 'Температура применения, (град. C)': 'от +5', 'Рекомендованное количество слоев покрытия': '2-4', 'Расход (1 слой), (кв.м/л)': '9-13', 'Время высыхания между слоями (ч)': '12', 'Тип поверхности': 'кирпич\xa0/\xa0бетон\xa0/\xa0натуральный камень\xa0/\xa0дерево\xa0/\xa0ДВП\xa0/\xa0ДСП\xa0/\xa0минеральные поверхности', 'Фасовка (л)': '2'}"
